title,authors,publisher,publishedDate,description,categories,pageCount,language,previewLink,averageRating,ratingsCount
The Américas Award,Laretta Henderson,Bloomsbury Publishing PLC,2015-12-16,"First awarded in 1993, the Américas Award is given in recognition of books that authentically and engagingly portray Latino/as in Latin America, the Caribbean or the United States. By combining both and linking the Americas, the award reaches beyond geographic borders, as well as multicultural-international boundaries, focusing instead upon cultural heritages within the hemisphere. The Award is unique in that selects Latino/a youth literature for classroom use and in that it focuses on the entire Western Hemisphere. Scholars from the fields of literature, education, lbrary science, and theater engage with Latino/a Critical Race Theory (LatCrit) in this ecollection of essays about the Américas Award, the Award-winning and honored books, and the contexts in which the books are used. This collection offers essays on the history of the award, close readings of Award-winning and honored books situated in the classroom, and discussions of how best to use the books in the classroom, library and theater.",Literary Criticism,229.0,en,http://books.google.de/books?id=wCLuCgAAQBAJ&pg=PA64&dq=awarded+books&hl=&as_pt=BOOKS&cd=1&source=gbs_api,,
Britannica Book of the Year 2009,"Encyclopaedia Britannica, Inc.","Encyclopaedia Britannica, Inc.",2009-03-01,"The Britannica Book of the Year 2009 provides a valuable veiwpoint of the people and events that shaped the year and serves as a great reference source for the latest news on the ever changing populations, governments, and economies throughout the world. It is an accurate and comprehensive reference that you will reach for again and again.",Juvenile Nonfiction,882.0,en,http://books.google.de/books?id=IaecAAAAQBAJ&pg=PA256&dq=awarded+books&hl=&as_pt=BOOKS&cd=2&source=gbs_api,5.0,1.0
"Miscellaneous picture and story books for children, ed. by E.W. Vredenburg. 1-51",Edric Vredenburg,,1894,,,112.0,en,http://books.google.de/books?id=fGW96P9M1k0C&pg=PT10&dq=awarded+books&hl=&as_pt=BOOKS&cd=3&source=gbs_api,,
Proceedings,Chicago (Ill.). Board of Education,,1875,,Education,184.0,en,http://books.google.de/books?id=T9ITXYUica4C&pg=PA3&dq=awarded+books&hl=&as_pt=BOOKS&cd=4&source=gbs_api,,
Books from the U.S.A.,,,1957,,American literature,588.0,en,http://books.google.de/books?id=njMZAQAAIAAJ&q=awarded+books&dq=awarded+books&hl=&as_pt=BOOKS&cd=5&source=gbs_api,,
Brown Book,,,1898,,,630.0,en,http://books.google.de/books?id=OJYoAAAAYAAJ&pg=RA2-PA100&dq=awarded+books&hl=&as_pt=BOOKS&cd=6&source=gbs_api,,
Multicultural Literature for Latino Bilingual Children,"Ellen Riojas Clark, Belinda Bustos Flores, Daniel Alejandro González",Bloomsbury Publishing USA,2025-09-18,"Multicultural Literature for Latino Bilingual Children: Their Words, Their Worlds 2nd Edition, is a comprehensive theory to practice book for preparing teachers and librarians. Pertinent references to Latino children's literature, classroom activities, and additional resources are provided throughout to make content accessible, incorporate community knowledge, and expand critical thinking and imagination.",Education,401.0,en,http://books.google.de/books?id=ywWNEQAAQBAJ&pg=PA36&dq=awarded+books&hl=&as_pt=BOOKS&cd=7&source=gbs_api,,
Calendar,University of Cambridge,,1896,,,1200.0,en,http://books.google.de/books?id=_EA4AAAAMAAJ&pg=RA3-PA732&dq=awarded+books&hl=&as_pt=BOOKS&cd=8&source=gbs_api,,
"Register of the associates and old students of the Royal college of chemistry, the Royal school of mines, and the Royal college of science; with intr. by T.G. Chambers","London univ, imp. coll. of sci. and technol, roy. coll. of sci, Sir Theodore Gervase Chambers",,1896,,Scientists,420.0,en,http://books.google.de/books?id=ae5RJ9RZAbwC&pg=PA204&dq=awarded+books&hl=&as_pt=BOOKS&cd=9&source=gbs_api,,
The Bombay university calendar,"Bombay city, univ",,1892,,,794.0,en,http://books.google.de/books?id=MOgpKBt0TMkC&pg=PA270&dq=awarded+books&hl=&as_pt=BOOKS&cd=10&source=gbs_api,,
New Zealand Books in Print,,,1988,,New Zealand,300.0,en,http://books.google.de/books?id=huPiyu6ddqQC&pg=PR20&dq=awarded+books&hl=&as_pt=BOOKS&cd=11&source=gbs_api,,
Australian Books in Print,,,1987,,Australia,824.0,en,http://books.google.de/books?id=s9c3AAAAIAAJ&q=awarded+books&dq=awarded+books&hl=&as_pt=BOOKS&cd=12&source=gbs_api,,
The Educational calendar and scholastic year book [ed. by F. Marcus].,,,1871,,,438.0,en,http://books.google.de/books?id=B-ENAAAAQAAJ&pg=PA47&dq=awarded+books&hl=&as_pt=BOOKS&cd=13&source=gbs_api,,
The Educational year book. [5 issues].,,,1882,,,592.0,en,http://books.google.de/books?id=niUOAAAAQAAJ&pg=PA110&dq=awarded+books&hl=&as_pt=BOOKS&cd=14&source=gbs_api,,
Writers' and Artists' Year-book,,,1976,,Arts,470.0,en,http://books.google.de/books?id=VutgAAAAIAAJ&q=awarded+books&dq=awarded+books&hl=&as_pt=BOOKS&cd=15&source=gbs_api,,
"Awards Honors & Prizes, Volume 2",Thomson Gale,Gale Cengage,2007-04,"This international directory describes awards given for achievements in virtually every field of endeavor. Awards are listed alphabetically by the name of the administering organization, followed by alphabetical listings and descriptions of each of the awards it offers. Each volume contains organization, award, and subject indexes for quick reference. This reference includes e-mail addresses and URLs.",Reference,680.0,en,http://books.google.de/books?id=Nmk7AQAAIAAJ&q=awarded+books&dq=awarded+books&hl=&as_pt=BOOKS&cd=16&source=gbs_api,,
"Annual Report of the Regents of the University, to the Legislature of the State of New-York",University of the State of New York. Board of Regents,,1879,,Education,634.0,en,http://books.google.de/books?id=OzcdAQAAIAAJ&pg=PA14&dq=awarded+books&hl=&as_pt=BOOKS&cd=17&source=gbs_api,,
The Publishers Weekly,,,1876,,American literature,874.0,en,http://books.google.de/books?id=8xgDAAAAYAAJ&pg=PA117&dq=awarded+books&hl=&as_pt=BOOKS&cd=18&source=gbs_api,,
The Dublin University Calendar,"Trinity College (Dublin, Ireland)",,1892,,,846.0,en,http://books.google.de/books?id=lWstAQAAMAAJ&pg=RA2-PA55&dq=awarded+books&hl=&as_pt=BOOKS&cd=19&source=gbs_api,,
A Catalogue of Award-winning Titles,,,2008,,Philippines,238.0,en,http://books.google.de/books?id=zN7fAAAAMAAJ&pg=PP6&dq=awarded+books&hl=&as_pt=BOOKS&cd=20&source=gbs_api,,
The Wisconsin Farmer,,,1900,,Agriculture,852.0,en,http://books.google.de/books?id=haHgnLrTSf0C&pg=PA184&dq=awarded+books&hl=&as_pt=BOOKS&cd=41&source=gbs_api,,
Critical Perspectives on Postcolonial African Children's and Young Adult Literature,Meena Khorana,Praeger,1998-04-08,"The past few years mark a growing scholarly interest in African children's literature in the United States. Several books have recently been published on the subject, and the number of papers on African children's literature presented at conferences or published in scholarly journals also seems to have increased. These publications are becoming more and more sophisticated as scholars move away from general country surveys or analyses of publishing conditions and instead analyze literary structures, themes, and illustrations, or apply Marxist, feminist, or postcolonial theories to interpret literary works. The question of an authentic voice in postcolonial African children's literature has emerged as a central concern to those who care about books for African children and young adults. Also of importance is the matter of how Africa is presented in literature for children who do not live on that continent. The essays in this book either take a postcolonial or revisionist approach to the study of colonial literature, or discuss books published after decolonization. The introductory essay provides a general analysis of the key issues facing the publication of children's books in postcolonial Africa—issues of national identity, language, appropriate genres, and relevant themes to inculcate a nationalistic outlook in children and young adults. The chapters that follow are located within this broad framework and are written by expert contributors. While these essays reflect the scholarly interests and specialization of each author, they also span the entire field of African children's literature. The first group of chapters surveys African children's literature from a variety of angles and explores such topics as literacy and the publishing culture in Africa, the role and importance of awards, Nigerian young adult literature, and the relevance of folktales. The book then turns to a discussion of books about Africa written by Western authors for Western readers, which often project values and perspectives that betray a continuing colonial bias. The last part of the book examines more specialized themes and concerns.",Literary Criticism,202.0,en,http://books.google.de/books?id=y6xkAAAAMAAJ&q=awarded+books&dq=awarded+books&hl=&as_pt=BOOKS&cd=42&source=gbs_api,,
The Times of India Directory and Year Book Including Who's who,Sir Stanley Reed,,1971,"Issues for 1919-47 include Who's who in India; 1948, Who's who in India and Pakistan.",India,1038.0,en,http://books.google.de/books?id=ZgQfAQAAMAAJ&q=awarded+books&dq=awarded+books&hl=&as_pt=BOOKS&cd=43&source=gbs_api,,
Emergency Librarian,,,1989,,Instructional materials centers,80.0,en,http://books.google.de/books?id=bu4OAQAAMAAJ&q=awarded+books&dq=awarded+books&hl=&as_pt=BOOKS&cd=44&source=gbs_api,,
Documents of the Senate of the State of New York,New York (State). Legislature. Senate,,1877,,,1538.0,en,http://books.google.de/books?id=pKQlAQAAIAAJ&pg=RA2-PA16&dq=awarded+books&hl=&as_pt=BOOKS&cd=45&source=gbs_api,,
Statistical Register,Australia. Commonwealth Bureau of Census and Statistics. New South Wales Office,,1917,Included also as a part of some vols. of the office's annual Statistical register until it ceased publication with vol. for 1954/55.,Mineral industries,1276.0,en,http://books.google.de/books?id=zRYtAQAAMAAJ&q=awarded+books&dq=awarded+books&hl=&as_pt=BOOKS&cd=46&source=gbs_api,,
In Jewish Bookland,,,1947,,Books,314.0,en,http://books.google.de/books?id=FrfAUEOupoUC&q=awarded+books&dq=awarded+books&hl=&as_pt=BOOKS&cd=47&source=gbs_api,,
Journal of Education and School World,,,1889,,Education,664.0,en,http://books.google.de/books?id=NpRFAQAAMAAJ&pg=PA40&dq=awarded+books&hl=&as_pt=BOOKS&cd=48&source=gbs_api,,
American Printer and Bookmaker,,,1894,,Bookbinding,302.0,en,http://books.google.de/books?id=23_nAAAAMAAJ&pg=PA24&dq=awarded+books&hl=&as_pt=BOOKS&cd=49&source=gbs_api,,
Transactions of the Institution of Engineers and Shipbuilders in Scotland,Institution of Engineers and Shipbuilders in Scotland,,1930,,Engineering,772.0,en,http://books.google.de/books?id=S3NqAAAAMAAJ&q=awarded+books&dq=awarded+books&hl=&as_pt=BOOKS&cd=50&source=gbs_api,,
The American Bookseller,,,1876,,American literature,554.0,en,http://books.google.de/books?id=UcwpAAAAYAAJ&pg=PA260&dq=awarded+books&hl=&as_pt=BOOKS&cd=51&source=gbs_api,,
The Critic,,,1895,,,478.0,en,http://books.google.de/books?id=k1lDAQAAMAAJ&pg=PA125&dq=awarded+books&hl=&as_pt=BOOKS&cd=52&source=gbs_api,,
Library Association Year Book,Library Association,,1992,List of members in each volume.,Libraries,456.0,en,http://books.google.de/books?id=FtoaAQAAMAAJ&q=awarded+books&dq=awarded+books&hl=&as_pt=BOOKS&cd=53&source=gbs_api,,
The American School Board Journal,"William George Bruce, William Conrad Bruce",,1898,,Education,520.0,en,http://books.google.de/books?id=-CgxAQAAMAAJ&pg=RA2-PA12&dq=awarded+books&hl=&as_pt=BOOKS&cd=54&source=gbs_api,,
Elementary Children's Literature,Nancy A. Anderson,Allyn & Bacon,2002,"Written in a personable tone, this concise literature methods text is filled with classroom applications and teaching strategies for future teachers and parents of preschool and elementary children. Organized around genres, this student-friendly text presents the basic children's literature course content. Each genre chapter contains extensive up-to-date bibliographies most with annotations of books in print, and a few exceptional out-of-print books, and for each genre, there is a list of evaluation criteria. This exceptional textbook not only includes books about minorities in each chapter but it also features works by minority authors and illustrators. Uniquely, Elementary Children's Literature offers instructional and curriculum tie-ins that are woven within the text and in literature response boxes at strategic places in each chapter. Book illustrations are included at the beginning of each chapter as well as throughout the narrative.",Education,404.0,en,http://books.google.de/books?id=TB_uAAAAMAAJ&q=awarded+books&dq=awarded+books&hl=&as_pt=BOOKS&cd=55&source=gbs_api,,
Books on Trial,,,1954,,American literature,952.0,en,http://books.google.de/books?id=207pAAAAMAAJ&q=awarded+books&dq=awarded+books&hl=&as_pt=BOOKS&cd=56&source=gbs_api,,
Anthropology News,,,2004,,Anthropological linguistics,308.0,en,http://books.google.de/books?id=AhwNAQAAMAAJ&q=awarded+books&dq=awarded+books&hl=&as_pt=BOOKS&cd=57&source=gbs_api,,
Essentials of Young Adult Literature,"Carl M. Tomlinson, Carol Lynch-Brown",Allyn & Bacon,2007,"""Essentials of Young Adult Literature"" Based on a genre approach to literature, this long-awaited book offers a comprehensive, clear, and succinct overview of adolescent literature. It includes recommended books listed by genre and topic, and engages readers by offering a thorough discussion of the major trends and issues affecting young adult literature such as censorship, the literary canon, and accountability. It provides clearly stated positions on the current issues affecting schools and literature. Written by well-known authors Carl Tomlinson and Carol Lynch-Brown, ""Essentials of Young Adult Literature"" places emphasis on reading a wide variety of young adult literature and addresses all types and formats of literature including novels, short stories, graphic novels, and picture books for older readers. In addition, notable authors are featured in each genre chapter and multicultural and international literature is integrated throughout the book and then treated more fully in its own chapter. Current and future teachers will appreciate the authors' practical strategies for connecting secondary school students with young adult books, such as how to select books that students will read and enjoy, how to motivate resistant readers to read, and how to develop text sets for classroom study across the curriculum. Readers will be equipped with the knowledge to use trade books as excellent teaching and learning materials and will not be limited to using textbooks alone. Key Features ""Literature Across the Curriculum"" features found in all genre chapters give examples of how young adult literature can help students and teachers in the content areas learn or present course content in a more interesting, memorable way. Extensive lists of recommended books briefly annotated with topics and age levels follow each genre chapter. One full chapter devoted to addressing the specific needs of resistant readers give middle and high school teachers much-needed strategies for addressing common obstacles to reading and for motivating students to read. Every chapter presents one to three charts with information about milestone books, history of specific genres, and research. Appendices feature Young Adult Book Award lists and YA Magazines, organized by content area and include ordering information. By the same authors Essentials of Children's Literature, Fifth Edition (c)2005, Allyn & Bacon, ISBN 0-205-42015-X For more information, please visit www.ablongman.com",Education,308.0,en,http://books.google.de/books?id=Sx_uAAAAMAAJ&q=awarded+books&dq=awarded+books&hl=&as_pt=BOOKS&cd=58&source=gbs_api,,
"The Saturday Review of Politics, Literature, Science and Art",,,1898,,,912.0,en,http://books.google.de/books?id=Ah8QIfB2WH0C&pg=PA151-IA2&dq=awarded+books&hl=&as_pt=BOOKS&cd=59&source=gbs_api,,
Library Literature,,,1984,,Information science,664.0,en,http://books.google.de/books?id=UDmaAAAAIAAJ&q=awarded+books&dq=awarded+books&hl=&as_pt=BOOKS&cd=60&source=gbs_api,,
Illinois Reading Council Journal,,,2013,,Reading,296.0,en,http://books.google.de/books?id=94ELq7xCul4C&q=awarded+books&dq=awarded+books&hl=&as_pt=BOOKS&cd=81&source=gbs_api,,
Proceedings of the Board of Directors of the Chicago Public Library,Chicago Public Library,,1920,,,458.0,en,http://books.google.de/books?id=AK0yrJN1Du8C&q=awarded+books&dq=awarded+books&hl=&as_pt=BOOKS&cd=82&source=gbs_api,,
International Literary Market Place 2003,Information Today Inc,Information Today,2002,"Plus, ILMP 2003 includes two publisher indexes--Types of Publications Index and Subject Index--that offer access to publishers via some 142 headings. Additional coverage includes information on international literary prizes, copyright conventions, a yellow pages directory, and a worldwide calendar of events through 2003.",Language Arts & Disciplines,1776.0,en,http://books.google.de/books?id=lIEbAQAAMAAJ&q=awarded+books&dq=awarded+books&hl=&as_pt=BOOKS&cd=83&source=gbs_api,,
News Notes of California Libraries,California State Library,,1931,Vols. for 1971- include annual reports and statistical summaries.,Libraries,1278.0,en,http://books.google.de/books?id=O-dNAQAAMAAJ&q=awarded+books&dq=awarded+books&hl=&as_pt=BOOKS&cd=84&source=gbs_api,,
Little Folks,,,1898,,,1216.0,en,http://books.google.de/books?id=W1ihlxE0BU4C&pg=PA72&dq=awarded+books&hl=&as_pt=BOOKS&cd=85&source=gbs_api,,
City Record,Boston (Mass.),,1925,,Boston (Mass.),1750.0,en,http://books.google.de/books?id=Z_SEqeUsbp0C&q=awarded+books&dq=awarded+books&hl=&as_pt=BOOKS&cd=86&source=gbs_api,,
Library Journal,,,1968,,Libraries,1150.0,en,http://books.google.de/books?id=aEY8AQAAIAAJ&q=awarded+books&dq=awarded+books&hl=&as_pt=BOOKS&cd=87&source=gbs_api,,
Haverford College Catalog,Haverford College,,1903,,College catalogs,442.0,en,http://books.google.de/books?id=wUpKAQAAMAAJ&q=awarded+books&dq=awarded+books&hl=&as_pt=BOOKS&cd=88&source=gbs_api,,
Official Report,Saint Louis (Mo.). Board of Education,,1892,,Saint Louis (Mo.),1214.0,en,http://books.google.de/books?id=YvjeAAAAMAAJ&pg=PA326&dq=awarded+books&hl=&as_pt=BOOKS&cd=89&source=gbs_api,,
British Book News,,,1991,,Best books,916.0,en,http://books.google.de/books?id=53UsAAAAYAAJ&q=awarded+books&dq=awarded+books&hl=&as_pt=BOOKS&cd=90&source=gbs_api,,
Poet's Market '97,Christine Martin,Writer's Digest Books,1996-09-15,"This directory helps poets match rhyme to reason when marketing their work. In it they will find 1,700 up-to-date listings--more than 300 new ones--of book and magazine publishers seeking poetry; contests and awards; grants awarded by the U.S. and Canadian arts councils; conferences, workshops, and writers' colonies; and pertinent organizations and publications. Illustrations.",Language Arts & Disciplines,608.0,en,http://books.google.de/books?id=zCdfidSjeoEC&q=awarded+books&dq=awarded+books&hl=&as_pt=BOOKS&cd=91&source=gbs_api,5.0,1.0
Bookman's Journal with which is Incorporated the Print Collector,,,1920,"V. 1-3 include ""Bibliographies of modern authors by Henry Danielson.""",Bibliography,1196.0,en,http://books.google.de/books?id=nLsWAQAAMAAJ&q=awarded+books&dq=awarded+books&hl=&as_pt=BOOKS&cd=92&source=gbs_api,,
The Unesco Courier,,,1976,,Developing countries,858.0,en,http://books.google.de/books?id=qdETAQAAMAAJ&q=awarded+books&dq=awarded+books&hl=&as_pt=BOOKS&cd=93&source=gbs_api,,
Alabama Bound,James Earl Colquitt,Livingston Press (AL),1995,"The twenty-eight stories which make up this memorable collection give powerful testimony to the richness and vitality of short story writing in Alabama. The collection contains exquisite stories by well-known writers such as Mary Ward Brown, Barry Hannah, Madison Jones, Albert Murray, Helen Norris, Eugene Walter and Tobias Wolff, as well as fine stories by authors such as Michelle Richmond and Kingman Cody Shelburne, who appear in print here for the first time.",Fiction,232.0,en,http://books.google.de/books?id=xvdZAAAAMAAJ&q=awarded+books&dq=awarded+books&hl=&as_pt=BOOKS&cd=94&source=gbs_api,,
"Belgium, Economy + Technique",,,1968,,Belgium,590.0,en,http://books.google.de/books?id=S9MHuMQz29UC&q=awarded+books&dq=awarded+books&hl=&as_pt=BOOKS&cd=95&source=gbs_api,,
Calendar for Session ...,McGill University,,1920,,,526.0,en,http://books.google.de/books?id=kmgZAAAAYAAJ&q=awarded+books&dq=awarded+books&hl=&as_pt=BOOKS&cd=96&source=gbs_api,,
News Year,,,1962,,"Almanacs, American",688.0,en,http://books.google.de/books?id=8Rw_xQxB2awC&q=awarded+books&dq=awarded+books&hl=&as_pt=BOOKS&cd=97&source=gbs_api,,
Passport,,,2008,,United States,226.0,en,http://books.google.de/books?id=sgQQAQAAMAAJ&q=awarded+books&dq=awarded+books&hl=&as_pt=BOOKS&cd=98&source=gbs_api,,
Annual Register of Grant Support,,,1987,,Endowments,1034.0,en,http://books.google.de/books?id=AEMaAQAAMAAJ&q=awarded+books&dq=awarded+books&hl=&as_pt=BOOKS&cd=99&source=gbs_api,,
Branch Library Book News ...,New York Public Library,,1927,,Classified catalogs,492.0,en,http://books.google.de/books?id=tt0aAAAAMAAJ&q=awarded+books&dq=awarded+books&hl=&as_pt=BOOKS&cd=100&source=gbs_api,,
International Literature,,,1970,,Russian literature,1480.0,en,http://books.google.de/books?id=4tIolflPYUIC&q=awarded+books&dq=awarded+books&hl=&as_pt=BOOKS&cd=121&source=gbs_api,,
Kansas Library Bulletin,"Kansas State Library, Kansas. Traveling Libraries Commission",,1971,,Libraries,218.0,en,http://books.google.de/books?id=G1DpAAAAMAAJ&q=awarded+books&dq=awarded+books&hl=&as_pt=BOOKS&cd=122&source=gbs_api,,
EUSA Review,,,2006,,,114.0,en,http://books.google.de/books?id=et8MAQAAMAAJ&q=awarded+books&dq=awarded+books&hl=&as_pt=BOOKS&cd=123&source=gbs_api,,
Bombay University Calendar,University of Bombay,,1916,,Universities and colleges,612.0,en,http://books.google.de/books?id=R1omAQAAIAAJ&q=awarded+books&dq=awarded+books&hl=&as_pt=BOOKS&cd=124&source=gbs_api,,
Madras Jurist,,,1875,,Law,482.0,en,http://books.google.de/books?id=JSI7AQAAMAAJ&pg=PA255&dq=awarded+books&hl=&as_pt=BOOKS&cd=125&source=gbs_api,,
Canadian Children's Literature,,,1994,,"Children's literature, Canadian",408.0,en,http://books.google.de/books?id=0LALAQAAMAAJ&q=awarded+books&dq=awarded+books&hl=&as_pt=BOOKS&cd=126&source=gbs_api,,
Bookseller & Stationer and Office Equipment Journal,,,1929,,Booksellers and bookselling,1012.0,en,http://books.google.de/books?id=iCvA6mmRJogC&q=awarded+books&dq=awarded+books&hl=&as_pt=BOOKS&cd=127&source=gbs_api,,
Young Wings,,,1937,,Children's literature,216.0,en,http://books.google.de/books?id=fNg_B9Vy3PwC&q=awarded+books&dq=awarded+books&hl=&as_pt=BOOKS&cd=128&source=gbs_api,,
Michigan Library News,Michigan State Library,,1951,,,574.0,en,http://books.google.de/books?id=sQK_AAAAIAAJ&q=awarded+books&dq=awarded+books&hl=&as_pt=BOOKS&cd=129&source=gbs_api,,
The Horn Book Magazine,"Bertha E. Mahony, Bertha E. Mahony Miller",,1945,"Vol. 2 includes extra number, ""Experimental schools in England,"" Jan. 1926.",Children's literature,702.0,en,http://books.google.de/books?id=ldY8AQAAIAAJ&q=awarded+books&dq=awarded+books&hl=&as_pt=BOOKS&cd=130&source=gbs_api,,
The Bowker Annual Library and Book Trade Almanac 2004,"Information Today, Incorporated",Information Today,2004-05,"As an on-the-job answer book, a statistical information resource, a planning and research guide, and a directory and calendar, The Bowker Annual Library and Book Trade Almanac 2004 delivers the hard-to-find industry news and information you need. This acclaimed must-have resource provides the following: Expert reviews of the key trends, events, and developments that will influence your work in 2004 and the years to come Clear explanations of new legislation and changes in funding programs-and how this will affect libraries Definitive statistics on book prices, numbers of books published, library expenditures, average salaries, and other budget-crunching assistance A full calendar of events, key organizations, names and numbers of important individuals (including e-mail addresses and fax numbers), and much more This fully updated reference tool makes it easy to stay on top of the developments that affect libraries, booksellers, and publishers alike-and to find fast answers to the countless on-the-job questions you encounter.",Language Arts & Disciplines,840.0,en,http://books.google.de/books?id=hvvgAAAAMAAJ&q=awarded+books&dq=awarded+books&hl=&as_pt=BOOKS&cd=131&source=gbs_api,,
Voice of Youth Advocates,,,1984,,Young adult literature,384.0,en,http://books.google.de/books?id=LVHpAAAAMAAJ&q=awarded+books&dq=awarded+books&hl=&as_pt=BOOKS&cd=132&source=gbs_api,,
"Public Documents of the State of North Dakota, Being the Annual and Biennial Reports of Various Public Officers and Institutions to the Governor and Legislative Assembly, for the Fiscal Period Ending ...",North Dakota,,1907,,North Dakota,2142.0,en,http://books.google.de/books?id=mwFFAQAAMAAJ&q=awarded+books&dq=awarded+books&hl=&as_pt=BOOKS&cd=133&source=gbs_api,,
Wisconsin Library Bulletin,,,1919,,Libraries,554.0,en,http://books.google.de/books?id=vS-KpZUnJaIC&pg=RA1-PA13&dq=awarded+books&hl=&as_pt=BOOKS&cd=134&source=gbs_api,,
Quill & Quire,,,1987,,Book industries and trade,562.0,en,http://books.google.de/books?id=rURVAAAAYAAJ&q=awarded+books&dq=awarded+books&hl=&as_pt=BOOKS&cd=135&source=gbs_api,,
Boys' Club Bulletin,,,1936,,Boys,450.0,en,http://books.google.de/books?id=5gYfAQAAMAAJ&q=awarded+books&dq=awarded+books&hl=&as_pt=BOOKS&cd=136&source=gbs_api,,
The Official Year Book of New South Wales ...,New South Wales. Statistician's office,,1928,,New South Wales,848.0,en,http://books.google.de/books?id=qzE9AAAAYAAJ&q=awarded+books&dq=awarded+books&hl=&as_pt=BOOKS&cd=137&source=gbs_api,,
